{
  "contract": "lekishi-historical-contract/v0",
  "document": "source",
  "source_id": "lks:source:chimei-taikei-ata",
  "source_hash": "sha256:bc6f40711fc771c6bd69865a3414f2e8b07b9ac41ca7a768d84a27faa9719484",
  "kind": "reference",
  "title": "日本歴史地名大系「阿多郡」",
  "edition": "kotobank.jp digital edition (partial article), read 2026-09-24",
  "author": "平凡社",
  "language": "ja",
  "identifiers": [
    {"system": "url", "value": "https://kotobank.jp/word/阿多郡-3105892"}
  ],
  "license": {
    "status": "recorded",
    "license_id": "all-rights-reserved",
    "attribution_text": "平凡社「日本歴史地名大系」, kotobank.jp",
    "redistribution": "not_permitted",
    "quotation_permitted": "unknown",
    "reviewed_by": "Lekishi editorial preparation",
    "reviewed_at": "2026-09-24T05:00:00Z",
    "notes": "Copyrighted reference work. Citation only: the chapter records that the work proposes the identification and does not reproduce or quote its text."
  },
  "notes": "The entry states that the 東征傳 places 秋妻屋浦, the landing place of the second ship that carried 鑒眞, in 薩摩国阿多郡 and proposes its identification with present-day 坊津 (比定). It is a modern scholarly identification, not a source statement of the eighth century."
}
