{
  "contract": "lekishi-historical-contract/v0",
  "document": "source",
  "source_id": "lks:source:toseiden",
  "source_hash": "sha256:f21eecdcc1405410e364d34ac509180e4ce6e51541535fe734e70b34e213a5dc",
  "kind": "primary",
  "title": "唐大和上東征傳 (Tōdaiwajō tōseiden)",
  "edition": "Wikisource digital transcription of the Taishō Tripiṭaka text (T.2089, 遊方記抄), unproofread; locators re-checked against it on 2026-09-24; re-check against a critical edition before content freeze",
  "author": "淡海三船 (真人元開)",
  "issued": {"year": 779, "era": "ce"},
  "language": "lzh",
  "identifiers": [
    {"system": "url", "value": "https://zh.wikisource.org/wiki/唐大和上東征傳"},
    {"system": "other", "value": "Taishō Tripiṭaka T.2089"}
  ],
  "license": {
    "status": "recorded",
    "license_id": "public-domain",
    "attribution_text": "唐大和上東征傳 (779), Wikisource transcription of Taishō T.2089",
    "redistribution": "permitted",
    "quotation_permitted": true,
    "reviewed_by": "Lekishi editorial preparation",
    "reviewed_at": "2026-09-24T05:00:00Z",
    "notes": "The work and its text are public domain. The transcription is unproofread and marks damaged or supplied characters with brackets or ■, so quoted passages must be re-checked against a critical edition."
  },
  "notes": "Hagiographic biography written by 淡海三船 (真人元開) and dated 779. It is the only continuous narrative of the return voyage and the source of the transmission list and the ordination account. It is a later, commemorative account: it is evidence of what it reports, not proof that every reported event occurred as described, and its miracle material is excluded from the chapter."
}
