{
  "contract": "lekishi-historical-contract/v0",
  "document": "source",
  "source_id": "lks:source:shiji",
  "source_hash": "sha256:8aacfcd9f0172a1da2aff4041e942597e6438c8acad0020dccf917acb7f94c18",
  "kind": "primary",
  "title": "史記 卷六 秦始皇本紀、卷十五 六國年表、卷四十五 韓世家、卷六十三 老子韓非列傳",
  "edition": "Wikisource digital transcription (unproofread); locators re-checked against it on 2026-09-25",
  "author": "司馬遷",
  "issued": {"year": 91, "era": "bce"},
  "language": "lzh",
  "identifiers": [
    {"system": "url", "value": "https://zh.wikisource.org/wiki/史記/卷006"},
    {"system": "url", "value": "https://zh.wikisource.org/wiki/史記/卷015"},
    {"system": "url", "value": "https://zh.wikisource.org/wiki/史記/卷045"},
    {"system": "url", "value": "https://zh.wikisource.org/wiki/史記/卷063"}
  ],
  "license": {
    "status": "recorded",
    "license_id": "public-domain",
    "attribution_text": "史記 (c. 91 BCE), Wikisource transcription",
    "redistribution": "permitted",
    "quotation_permitted": true,
    "reviewed_by": "Lekishi editorial preparation",
    "reviewed_at": "2026-09-25T03:00:00Z",
    "notes": "Text public domain. The fixture cites the annals and the six-states table, the hereditary house, and the biography, and quotes short passages from them. The Wikisource transcription is unproofread and marks damaged characters, so every locator must be re-checked against a critical edition before content freeze."
  },
  "notes": "The Han-era history. The fixture uses the 秦始皇本紀 annals and the 六國年表 alignment for the absolute years, the 韓世家 for Han's own account, and the 老子韓非列傳 biography for the disputed death. The hereditary house's transcription reads 潁州郡 where the annals read 潁川, and dates the embassy to 王安五年 where the table aligns the year with 王安六年; both variants are recorded rather than resolved."
}
