{
  "contract": "lekishi-historical-contract/v0",
  "document": "source",
  "source_id": "lks:source:kagoshima-folk-ishigaki",
  "kind": "reference",
  "title": "鹿児島県「鹿児島の民俗」頴娃海村の景観と海運遺構",
  "edition": "鹿児島県ウェブサイト (民俗データベース), read 2026-09-24",
  "author": "鹿児島県",
  "language": "jpn",
  "identifiers": [
    {
      "system": "url",
      "value": "https://hantoubunka.site.kagoshima.jp/minzoku/30.02daui.html"
    }
  ],
  "license": {
    "status": "recorded",
    "license_id": "all-rights-reserved",
    "attribution_text": "鹿児島県「鹿児島の民俗」",
    "redistribution": "not_permitted",
    "quotation_permitted": "unknown",
    "reviewed_by": "Lekishi editorial preparation",
    "reviewed_at": "2026-09-24T05:00:00Z",
    "notes": "Government website page. Citation only: the chapter records that the page states the drift place and does not reproduce its text."
  },
  "notes": "The page, on the 石垣 sea port of 頴娃, states that 石垣 is known as the place where a 遣唐使 ship drifted in 天平勝宝六年 (754). It records the local identification of the chronicle's 石籬浦; the identification is a modern statement, not a source statement of the eighth century.",
  "source_hash": "sha256:be054790a6e38cd5a4a15477b9424009a84d3c8ab4f36450b4a0dc75efe78ff4"
}
