{
  "contract": "lekishi-historical-contract/v0",
  "document": "source",
  "source_id": "lks:source:okinawa-daihyakka-ajinawa",
  "source_hash": "sha256:9a1a4778786333f5d2af7cd6592c96a3886525810dd86a4b7d8c08642851e70f",
  "kind": "reference",
  "title": "琉球新報『沖縄大百科事典』「阿児奈波島」",
  "edition": "ryukyushimpo.jp digital edition, read 2026-09-24",
  "author": "琉球新報社",
  "language": "ja",
  "identifiers": [
    {"system": "url", "value": "https://ryukyushimpo.jp/okinawa-dic/prentry-40063.html"}
  ],
  "license": {
    "status": "recorded",
    "license_id": "all-rights-reserved",
    "attribution_text": "琉球新報社『沖縄大百科事典』「阿児奈波島」",
    "redistribution": "not_permitted",
    "quotation_permitted": "unknown",
    "reviewed_by": "Lekishi editorial preparation",
    "reviewed_at": "2026-09-24T05:00:00Z",
    "notes": "Copyrighted reference work. Citation only: the chapter records that the entry makes the identification and does not reproduce or quote its text."
  },
  "notes": "The entry states that 阿児奈波島, the island name in the 東征傳, refers to 沖縄島, and that the route through it is one basis for the 南島路 reading. It is a modern identification, not a source statement of the eighth century."
}
