{
  "contract": "lekishi-historical-contract/v0",
  "document": "source",
  "source_id": "lks:source:jiu-tangshu",
  "source_hash": "sha256:b02e0b9bb6bbf60dfbcdcc8fbf130e2dee0818d51a0c8281119a898ab8108196",
  "kind": "primary",
  "title": "舊唐書 卷一九九上 東夷 日本國",
  "edition": "Wikisource digital transcription (unproofread); locators re-checked against it on 2026-09-24",
  "author": "劉昫 et al.",
  "issued": {"year": 945, "era": "ce"},
  "language": "lzh",
  "identifiers": [
    {"system": "url", "value": "https://zh.wikisource.org/wiki/舊唐書/卷199上"}
  ],
  "license": {
    "status": "recorded",
    "license_id": "public-domain",
    "attribution_text": "舊唐書 (945), Wikisource transcription",
    "redistribution": "permitted",
    "quotation_permitted": true,
    "reviewed_by": "Lekishi editorial preparation",
    "reviewed_at": "2026-09-24T05:00:00Z",
    "notes": "Text public domain. The chapter uses the Tang-court notice of the 天寶十二年 embassy and the outline of 朝衡's career; it does not use the compilation's later, legendary material."
  },
  "notes": "Tang-court-centred history compiled in 945. It reports the embassy from the Tang side, at year granularity, and describes 朝臣仲滿 (阿倍仲麻呂) under his adopted name 朝衡."
}
