{
  "contract": "lekishi-historical-contract/v0",
  "document": "source",
  "source_id": "lks:source:shoku-nihongi",
  "source_hash": "sha256:e263132f5953555ac8cfefaed3a20047dbe2675a3cb043e72b96ab8be1b7f89d",
  "kind": "primary",
  "title": "續日本紀 (Shoku Nihongi)",
  "edition": "Wikisource digital transcription (unproofread); locators re-checked against it on 2026-09-24; re-check against a critical edition (新訂増補国史大系 or 新日本古典文学大系) before content freeze",
  "author": "菅野朝臣眞道 et al. (court-ordered compilation)",
  "issued": {"year": 797, "era": "ce"},
  "language": "lzh",
  "identifiers": [
    {"system": "url", "value": "https://zh.wikisource.org/wiki/續日本紀"}
  ],
  "license": {
    "status": "recorded",
    "license_id": "public-domain",
    "attribution_text": "續日本紀 (797), Wikisource transcription",
    "redistribution": "permitted",
    "quotation_permitted": true,
    "reviewed_by": "Lekishi editorial preparation",
    "reviewed_at": "2026-09-24T05:00:00Z",
    "notes": "The work and its text are public domain. The Wikisource page text is additionally CC BY-SA 4.0; the chapter cites the work and the edition, not the wiki page, and quotes only the public-domain classical text. The transcription is unproofread and uses ■ where characters are damaged or unavailable, so a quoted passage must be re-checked against a critical edition."
  },
  "notes": "Court-ordered chronicle of 697–791, the primary Japanese court record for this chapter. Locators name the volume and the entry's date expression; the entries carry month and sexagenary day, so v0 normalizes them to the month and keeps the day in source_expression."
}
