{
  "contract": "lekishi-historical-contract/v0",
  "document": "source",
  "source_id": "lks:source:yamakawa-nihonshi-tane",
  "source_hash": "sha256:cebeab68f061b6a5168e208fbc4210cba3164cbf9ad244fd61278616dbd65960",
  "kind": "reference",
  "title": "山川 日本史小辞典 改訂新版「多禰島」",
  "edition": "kotobank.jp digital edition, read 2026-09-24",
  "author": "山川出版社",
  "language": "ja",
  "identifiers": [
    {"system": "url", "value": "https://kotobank.jp/word/多禰島"}
  ],
  "license": {
    "status": "recorded",
    "license_id": "all-rights-reserved",
    "attribution_text": "山川出版社「山川 日本史小辞典 改訂新版」, kotobank.jp",
    "redistribution": "not_permitted",
    "quotation_permitted": "unknown",
    "reviewed_by": "Lekishi editorial preparation",
    "reviewed_at": "2026-09-24T05:00:00Z",
    "notes": "Copyrighted reference work. Citation only: the chapter records that the work identifies the historical island area and does not reproduce or quote its text."
  },
  "notes": "The entry describes 多禰島 (also written 多褹島) as an island of 西海道 covering the present-day Tanegashima and Yakushima area. The identification is area-level, so the chapter places a label anchor only and does not assert a site."
}
