{
  "contract": "lekishi-historical-contract/v0",
  "document": "source",
  "source_id": "lks:source:zizhi-tongjian",
  "source_hash": "sha256:1423d95b9b93f87b06169f660fae152c348e96587d7ba37cde09fc6fd834bb7d",
  "kind": "primary",
  "title": "資治通鑑 卷六 秦紀一",
  "edition": "Wikisource digital transcription (unproofread, with later annotations); locators re-checked against it on 2026-09-25",
  "author": "司馬光",
  "issued": {"year": 1084, "era": "ce"},
  "language": "lzh",
  "identifiers": [
    {"system": "url", "value": "https://zh.wikisource.org/wiki/資治通鑑/卷006"}
  ],
  "license": {
    "status": "recorded",
    "license_id": "public-domain",
    "attribution_text": "資治通鑑 (1084), Wikisource transcription",
    "redistribution": "permitted",
    "quotation_permitted": true,
    "reviewed_by": "Lekishi editorial preparation",
    "reviewed_at": "2026-09-25T03:00:00Z",
    "notes": "Text public domain. The transcription includes later annotations and text-critical notes (for example the correction of 勝 to 騰 in the 230 BCE entry); the fixture cites the main text only, and the annotations are not used as evidence."
  },
  "notes": "The Song comprehensive mirror, used for the 始皇帝十四年, 十六年, and 十七年 entries: the submission and embassy, the cession of 南陽, and the annexation with the 潁川 commandery. Its absolute years are the fixture's dating basis for the events the annals date by reign year."
}
