{
  "contract": "lekishi-historical-contract/v0",
  "document": "source",
  "source_id": "lks:source:hantoubunka-ishigaki",
  "kind": "reference",
  "title": "薩摩半島民俗文化博物館「頴娃海村の景観と海運遺構」",
  "edition": "hantoubunka.site.kagoshima.jp (virtual museum, one administrator), read 2026-09-24",
  "author": "井上賢一（薩摩半島民俗文化博物館）",
  "language": "jpn",
  "identifiers": [
    {
      "system": "url",
      "value": "https://hantoubunka.site.kagoshima.jp/minzoku/30.02daui.html"
    }
  ],
  "license": {
    "status": "recorded",
    "license_id": "all-rights-reserved",
    "attribution_text": "井上賢一「薩摩半島民俗文化博物館」",
    "redistribution": "not_permitted",
    "quotation_permitted": "unknown",
    "reviewed_by": "Lekishi editorial preparation",
    "reviewed_at": "2026-09-24T05:00:00Z",
    "notes": "The site states that its text, photographs, and videos are the author's and that copying or reproduction without permission is prohibited outside the cases the law allows. Citation only: the chapter records what the page states and does not reproduce its text."
  },
  "notes": "The page, in its account of the 石垣 sea port of 頴娃, states that 石垣 is known as the place where a 遣唐使 ship drifted in 天平勝宝六年 (754). It is a local-history account by the site's author, not a scholarly identification, not a prefectural government statement, and not a source statement of the eighth century.",
  "source_hash": "sha256:364f5c6d245206f5234eb577f224809f20eb1dc60ce3093b0b67b8df7f3f4f4a"
}
