{
  "contract": "lekishi-historical-contract/v0",
  "document": "source",
  "source_id": "lks:source:ryukyu-university-tokara",
  "source_hash": "sha256:8fde307becb3df9b777351b9bece7bd9da8076c966e6c6e8b90b45da76adbb0b",
  "kind": "scholarly",
  "title": "琉球と日本本土の遷移地域としてのトカラ列島の歴史的位置づけをめぐる総合的研究",
  "edition": "琉球大学学術リポジトリ open-access PDF (13410100-2.pdf), read 2026-09-24",
  "author": "高良倉吉, 山里純一, 池田栄史 et al.",
  "issued": {"year": 2009, "era": "ce"},
  "language": "ja",
  "identifiers": [
    {"system": "url", "value": "https://u-ryukyu.repo.nii.ac.jp/record/2004430/files/13410100-2.pdf"},
    {"system": "other", "value": "hdl:20.500.12000/9008"}
  ],
  "license": {
    "status": "recorded",
    "license_id": "all-rights-reserved",
    "attribution_text": "高良倉吉・山里純一ほか「琉球と日本本土の遷移地域としてのトカラ列島の歴史的位置づけをめぐる総合的研究」, 琉球大学学術リポジトリ (2009)",
    "redistribution": "not_permitted",
    "quotation_permitted": "unknown",
    "reviewed_by": "Lekishi editorial preparation",
    "reviewed_at": "2026-09-24T05:00:00Z",
    "notes": "The repository item page states no reuse licence, so the chapter treats the article as all rights reserved and uses it for citation only, without quotation or reproduction."
  },
  "notes": "The 南島路 article discusses the 東征傳 voyage sequence and the island identifications; it explicitly equates 益救島 with 屋久島 and treats 阿児奈波島 as 沖縄島. It also records the scholarly debate about whether the day sequence can be read as written, which the chapter preserves as a dispute rather than resolving."
}
