{
  "contract": "lekishi-historical-contract/v0",
  "document": "source",
  "source_id": "lks:source:wakayama-kibi-drift",
  "kind": "reference",
  "title": "和歌山県「吉備真備漂着之地」",
  "edition": "和歌山県ウェブサイト (県土整備部道路局道路政策課), read 2026-09-24",
  "author": "和歌山県",
  "language": "jpn",
  "identifiers": [
    {
      "system": "url",
      "value": "https://www.pref.wakayama.lg.jp/prefg/081300/d00214915.html"
    }
  ],
  "license": {
    "status": "recorded",
    "license_id": "all-rights-reserved",
    "attribution_text": "和歌山県「吉備真備漂着之地」",
    "redistribution": "not_permitted",
    "quotation_permitted": "unknown",
    "reviewed_by": "Lekishi editorial preparation",
    "reviewed_at": "2026-09-24T05:00:00Z",
    "notes": "Government website page. Citation only: the chapter records that the page reports the identification and does not reproduce its text."
  },
  "notes": "The page states that 吉備真備 drifted to 紀伊国牟漏崎 on his return, that 紀州藩's 紀伊続風土記 considered 牟漏崎 to be 太地の燈明崎, and that the place is marked as 吉備真備漂着之地. It reports a modern identification (比定), not a source statement of the eighth century.",
  "source_hash": "sha256:0f27cecc0b25f3c4d843e529c01a7de02f33da21c854af381b226e99220ddee2"
}
