{
  "contract": "lekishi-historical-contract/v0",
  "document": "source",
  "source_id": "lks:source:xin-tangshu",
  "source_hash": "sha256:8a900104e3397bfc7098d8610f812c2d76ee8e892133bf761cfae4d958b110bc",
  "kind": "primary",
  "title": "新唐書 卷二二〇 東夷 日本",
  "edition": "Wikisource digital transcription (unproofread); locators re-checked against it on 2026-09-24",
  "author": "歐陽修, 宋祁",
  "issued": {"year": 1060, "era": "ce"},
  "language": "lzh",
  "identifiers": [
    {"system": "url", "value": "https://zh.wikisource.org/wiki/新唐書/卷220"}
  ],
  "license": {
    "status": "recorded",
    "license_id": "public-domain",
    "attribution_text": "新唐書 (1060), Wikisource transcription",
    "redistribution": "permitted",
    "quotation_permitted": true,
    "reviewed_by": "Lekishi editorial preparation",
    "reviewed_at": "2026-09-24T05:00:00Z",
    "notes": "Text public domain. Used only for the 天寶十二載 notice of 朝衡's return to the Tang court and the outline of his career."
  },
  "notes": "Song-era history compiled in 1060, later than the events it reports. It reports 朝衡 (阿倍仲麻呂) returning to the Tang court in 天寶十二載 and later holding office; it does not give a death year in the passage checked."
}
