{
  "contract": "lekishi-historical-contract/v0",
  "document": "source",
  "source_id": "lks:source:wikidata",
  "source_hash": "sha256:f809e6af1b93dc1610af78d2e96d927d490335cc6089f36702e6f2b1c913761a",
  "kind": "dataset",
  "title": "Wikidata",
  "edition": "Wikidata item data read through the Wikidata API on 2026-09-24",
  "author": "Wikidata contributors",
  "identifiers": [
    {"system": "url", "value": "https://www.wikidata.org/wiki/Wikidata:Licensing"}
  ],
  "license": {
    "status": "recorded",
    "license_id": "CC0-1.0",
    "attribution_text": "Wikidata contributors, CC0 1.0",
    "redistribution": "permitted",
    "quotation_permitted": true,
    "reviewed_by": "Lekishi editorial preparation",
    "reviewed_at": "2026-09-24T05:00:00Z",
    "notes": "Structured data is CC0 and carries no accuracy guarantee. The chapter uses it for external identifiers and for modern label-anchor coordinates only, never as a historical claim, and records each item id as the locator."
  },
  "notes": "Used for the external identifiers the Wave 1A report found (mission, people, temples) and for the modern coordinates of label anchors. A coordinate taken from Wikidata is a modern map reference, not a historical location."
}
