{
  "contract": "lekishi-historical-contract/v0",
  "document": "source",
  "source_id": "lks:source:wikidata",
  "source_hash": "sha256:0709a438d7b939cca7eae38047e62b136ca1c0ab9cb38900db1e8e29338e2705",
  "kind": "dataset",
  "title": "Wikidata",
  "edition": "Wikidata item data read through the Wikidata API on 2026-09-25",
  "author": "Wikidata contributors",
  "identifiers": [
    {"system": "url", "value": "https://www.wikidata.org/wiki/Wikidata:Licensing"}
  ],
  "license": {
    "status": "recorded",
    "license_id": "CC0-1.0",
    "attribution_text": "Wikidata contributors, CC0 1.0",
    "redistribution": "permitted",
    "quotation_permitted": true,
    "reviewed_by": "Lekishi editorial preparation",
    "reviewed_at": "2026-09-25T03:00:00Z",
    "notes": "Structured data is CC0 and carries no accuracy guarantee. The fixture uses it for one modern label-anchor coordinate only, never as a historical claim, and records the item id as the locator."
  },
  "notes": "Used for the modern coordinate of the 新鄭市 label anchor (Q1024662). A coordinate taken from Wikidata is a modern map reference, not a historical location, and the fixture asserts no historical coordinate for any place."
}
